{
  "id": "ai-review",
  "title": "AI Review",
  "content": [
    {
      "id": "AI-CHECKLIST-001",
      "kind": "ai-checklist",
      "content": [
        "주석이 코드 동작을 단순 반복하지 않는지 확인",
        "주석이 실제 구현 및 오류·복구 계약과 정확히 일치하는지 확인",
        "실행 가능한 토큰이나 테스트 기대값이 변하지 않았는지 확인",
        "근거 없는 TODO, 비활성 코드 또는 범위 밖 변경이 없는지 확인"
      ]
    },
    {
      "id": "AI-REVIEW-STATUS",
      "kind": "ai-review-result",
      "content": "통과: 주석 정확성, annotation-only 범위, AST 동일성 및 범위 준수 확인; blocking finding 없음",
      "attributes": {
        "result": "pass",
        "checklistResult": "pass",
        "executionTarget": {
          "contractVersion": "2.0.0",
          "invocationId": "019fbd6c-abc9-7303-a703-6956b3b97ad6",
          "revision": 1,
          "attempt": 1
        }
      }
    }
  ],
  "subsections": []
}
