{
  "id": "work-definition",
  "title": "Work Definition",
  "content": [
    {
      "id": "GOAL-001",
      "kind": "goal",
      "content": "Push the reviewed and integrated main branch, refresh the configured agent-factory Git marketplace snapshot, reinstall agent-factory@agent-factory, and verify the installed version and enabled status."
    },
    {
      "id": "SCOPE-001",
      "kind": "scope",
      "content": [
        "Verify the source manifest version is 0.1.0+codex.20260725184616 and the cachebuster Work Unit is done and integrated.",
        "Read origin/main immediately before push and prove local main is a fast-forward descendant.",
        "Push exact local main to origin/main and verify the remote head equals the pushed commit.",
        "Run codex plugin marketplace upgrade agent-factory --json.",
        "Run codex plugin add agent-factory@agent-factory --json.",
        "Verify codex plugin list reports version 0.1.0+codex.20260725184616 as installed and enabled."
      ]
    },
    {
      "id": "OUT-001",
      "kind": "out-of-scope",
      "content": [
        "manifest, product code, skill, schema, or lifecycle contract edits",
        "direct marketplace.json or Codex config edits",
        "worktree cleanup or branch deletion",
        "new-thread smoke test",
        "PR creation or promotion"
      ]
    },
    {
      "id": "OUTPUT-001",
      "kind": "expected-output",
      "content": [
        "origin/main updated to the approved local main checkpoint commit",
        "agent-factory marketplace refresh receipt",
        "agent-factory@agent-factory reinstall receipt",
        "source and installed version equality evidence",
        "canonical execution, AI review, Human review, and report evidence"
      ]
    }
  ],
  "subsections": []
}
