{
  "id": "ai-review",
  "title": "AI Review",
  "content": [
    {
      "id": "AI-CHECKLIST-001",
      "kind": "ai-checklist",
      "content": [
        "4개 문구가 각 구현 보장과 정확히 일치하는지 확인",
        "동작 반복, 과장, 추정 또는 근거 없는 의도가 없는지 확인",
        "실행 가능한 AST와 테스트가 변경되지 않았는지 확인",
        "8개 스킬 정합성 검증의 범위와 finding 근거가 완전한지 확인",
        "검증 finding을 승인 없이 수정하지 않았는지 확인"
      ]
    },
    {
      "id": "AI-REVIEW-STATUS",
      "kind": "ai-review-result",
      "content": {
        "summary": "AI Review passed all recorded checklist items against commit 1ae14e9 and execution evidence.",
        "checks": [
          "Four corrected comments match the adjacent implementation guarantees.",
          "No comment merely restates code or asserts unsupported intent.",
          "Executable AST is identical for all three Python files.",
          "Eight-skill structure, references, asset ownership, metadata, stale references, and duplicate rule semantics were fully checked.",
          "No consistency finding was auto-fixed."
        ],
        "findings": [
          "Blocking findings: none.",
          "Non-blocking findings: none."
        ]
      },
      "attributes": {
        "result": "pass",
        "checklistResult": "pass",
        "executionTarget": {
          "contractVersion": "2.0.0",
          "invocationId": "019fbde3-ab26-7833-8c37-c444b3736ce4",
          "revision": 1,
          "attempt": 1
        }
      }
    }
  ],
  "subsections": []
}
