{
  "id": "execution",
  "title": "Execution",
  "content": [
    {
      "id": "EXECUTION-001",
      "kind": "execution-result",
      "content": {
        "status": "complete",
        "summary": "plugin-creator helper로 cachebuster를 갱신하고 승인된 누적 main 전체를 origin/main에 push했으며 remote marketplace 재설치와 설치 cache hook 일치 검증을 완료했다.",
        "changedArtifacts": [
          ".codex-plugin/plugin.json"
        ],
        "testsRun": [
          "plugin validation passed",
          "generated hook configuration check passed",
          "Artifact JSON guard 19 tests passed",
          "git diff check passed",
          "main and origin/main divergence 0",
          "installed cache hooks present and byte-identical"
        ],
        "deviations": [
          "새 thread에서 재설치된 plugin definition을 로드하고 hook trust/runtime 확인이 필요하다."
        ]
      },
      "attributes": {
        "status": "complete",
        "verificationResult": "pass",
        "executionTarget": {
          "contractVersion": "1.0.0",
          "invocationId": "promotion-20260726-a",
          "headCommit": "67eff31363566138d1f99daf2cdae28aa024305b",
          "revision": 1,
          "attempt": 1
        },
        "evidence": [
          "blocks/evidence/cachebuster-verification.md",
          "blocks/evidence/promotion-runtime-verification.md"
        ]
      }
    }
  ],
  "subsections": []
}
