{
  "id": "verification-and-traceability",
  "title": "Verification and Traceability",
  "content": [
    {
      "id": "VERIFICATION-STRATEGY-001",
      "kind": "verification-strategy",
      "content": {
        "commands": [
          "python3 skills/specification/scripts/specification.py validate .agent-factory/specifications/project-core --full",
          "python3 skills/specification/scripts/specification.py validate .agent-factory/specifications/work-unit-durable-execution-supervisor --full",
          "python3 -m unittest discover -s skills/work-unit-execution/tests",
          "python3 -m unittest discover -s skills/work-unit-planner/tests",
          "rg -n \"artifact_handoff|checkpointCommit|baseRefCommit|humanDecision|--head-commit\" skills"
        ],
        "semanticChecks": [
          "Main agent makes one sufficiency decision before launch.",
          "Launcher prompt declares Workflow Agent and requires execution.",
          "No approval or checkpoint decision occurs after launch.",
          "Specification-direct creates no worktree and updates primary canonical Specification.",
          "Worktree mode excludes .agent-factory.",
          "Interrupted and stale blocked Goal states automatically continue.",
          "Execution converges to review or explicit unrecoverable failure.",
          "Human result decision is rework or complete."
        ]
      }
    },
    {
      "id": "TRACEABILITY-001",
      "kind": "traceability",
      "content": {
        "intakeAnchor": ".agent-factory/intakes/local-untracked-agent-factory-control-plane#work-unit-basis",
        "mappings": [
          "Primary canonical CRUD -> DECISION-013, DECISION-015",
          "One-time sufficiency check -> DECISION-016",
          "Workflow Agent mandatory Goal+Exec launch -> DECISION-017",
          "Interrupted and stale blocked recovery -> DECISION-014",
          "Specification-direct vs worktree routing -> DECISION-015, DECISION-017",
          "No approval, checkpoint or immutable hash -> accepted Human statements in active Intake"
        ]
      }
    },
    {
      "id": "REVIEW-STATUS-001",
      "kind": "review-status",
      "content": {
        "status": "aligned",
        "aiVerification": "Specification manager full validation and implementation regression evidence required.",
        "humanStatus": "accepted",
        "note": "Human replaced checkpoint and approval-gated execution with one-time prelaunch sufficiency judgment and mandatory background Goal+Exec continuation."
      }
    }
  ],
  "subsections": []
}
