{
  "id": "request-and-goal",
  "title": "Request and Goal",
  "content": [
    {
      "id": "REQUEST-001",
      "kind": "human-request",
      "content": "/home/deus/workspace/agent-factory/codex-plugins/skills/main-agent와 /home/deus/workspace/agent-factory/codex-plugins/skills/workflow-agent의 이름을 agent-main과 agent-workflow로 변경한다."
    },
    {
      "id": "OUTCOME-001",
      "kind": "desired-outcome",
      "content": "역할 스킬의 디렉터리, 스킬 식별자, 호출 참조가 agent-main과 agent-workflow로 일치한다."
    },
    {
      "id": "SUCCESS-001",
      "kind": "success-criterion",
      "content": [
        "skills/agent-main과 skills/agent-workflow가 존재한다.",
        "기존 main-agent와 workflow-agent의 활성 코드 참조가 남지 않는다.",
        "관련 검증이 통과한다."
      ]
    }
  ],
  "subsections": []
}
