{
  "id": "basis",
  "title": "Basis",
  "content": [
    {
      "id": "BASIS-REF-001",
      "kind": "intake-basis-ref",
      "content": "Ready Intake에서 확정된 8개 스킬 문서·코드 충돌 해소 basis",
      "sourceRefs": [
        {
          "artifactType": "intake",
          "id": "audit-skill-language-conflicts",
          "path": ".agent-factory/intakes/audit-skill-language-conflicts",
          "anchor": {
            "sectionId": "work-unit-basis",
            "itemId": "BASIS-001"
          }
        }
      ]
    }
  ],
  "subsections": []
}
