{
  "id": "human-review",
  "title": "Human Review",
  "content": [
    {
      "id": "HUMAN-CHECKLIST-001",
      "kind": "human-checklist",
      "content": [
        "전달된 이동 경로와 제외 범위 확인",
        "표준 디렉터리 구조와 남은 assets 내용을 확인",
        "정확한 검증 명령과 결과 확인",
        "AI review findings와 남은 위험 확인",
        "worktree integration 필요 여부 확인"
      ]
    },
    {
      "id": "HUMAN-METHOD-001",
      "kind": "human-review-method",
      "content": "한국어 실행 결과를 검토하고 rework 또는 complete를 결정한다. complete는 worktree source branch를 자동 통합하며 push, 배포와 PR promotion은 별도 요청이다."
    },
    {
      "id": "HUMAN-REVIEW-STATUS",
      "kind": "human-review-result",
      "content": "검토 대기: scripts/로 이동된 세 파일, 활성 참조와 root 계산 변경, 16/134/158개 테스트 및 schema·CLI·plugin·legacy scan 통과, AI review 무지적, commit 521e3bd를 확인한 뒤 rework 또는 complete를 결정한다. complete 전에는 integration하지 않는다.",
      "attributes": {
        "status": "complete",
        "executionTarget": {
          "contractVersion": "2.0.0",
          "revision": 1,
          "attempt": 1,
          "invocationId": "019faeb5-c459-7f03-a229-ed402cacd623"
        },
        "decidedAt": "2026-07-29T16:54:36+00:00"
      }
    }
  ],
  "subsections": []
}
