{
  "id": "stakeholders-and-approval",
  "title": "Stakeholders and Approval",
  "content": [
    {
      "id": "OWNER-001",
      "kind": "decision-owner",
      "content": {
        "owner": "Human"
      }
    },
    {
      "id": "STAKEHOLDER-001",
      "kind": "stakeholder",
      "content": {
        "items": [
          "Human",
          "Main-Agent",
          "Intake-Agent"
        ]
      }
    },
    {
      "id": "APPROVAL-001",
      "kind": "approval-boundary",
      "content": {
        "boundary": "Human은 위임 정책과 예외를 결정하며 Main Agent는 Human-facing 및 lifecycle 결정을 유지한다."
      }
    }
  ],
  "subsections": []
}
