{
  "id": "human-review",
  "title": "Human Review",
  "content": [
    {
      "id": "HUMAN-CHECKLIST-001",
      "kind": "human-checklist",
      "content": [
        "변경 파일과 한 줄 diff 확인",
        "Ruff 및 관련 테스트 결과 확인"
      ]
    },
    {
      "id": "HUMAN-METHOD-001",
      "kind": "human-review-method",
      "content": "diff와 검증 결과를 확인하고 rework 또는 complete를 결정한다."
    },
    {
      "id": "HUMAN-REVIEW-STATUS",
      "kind": "human-review-result",
      "content": "Pending",
      "attributes": {
        "status": "pending"
      }
    }
  ],
  "subsections": []
}
