{
  "id": "context-and-scope",
  "title": "Context and Scope",
  "content": [
    {
      "id": "CONTEXT-001",
      "kind": "context",
      "content": "human-review는 SKILL.md와 agents/openai.yaml만 가진 얇은 표현 계층이며 결과 검토 흐름은 lifecycle과 main-agent에도 정의되어 있다."
    },
    {
      "id": "SCOPE-001",
      "kind": "scope",
      "content": [
        "skills/human-review/SKILL.md 제거",
        "skills/human-review/agents/openai.yaml 제거",
        "필요한 한국어 결과 검토 자료 규칙을 skills/main-agent/SKILL.md로 통합",
        "skills/lifecycle/SKILL.md의 human-review 스킬 라우팅 제거",
        "skills/lifecycle/tests/test_skill_metadata.py의 전용 human-review 테스트 정합화"
      ]
    },
    {
      "id": "OUT-001",
      "kind": "out-of-scope",
      "content": [
        "Work Unit profile의 human-review 섹션 제거",
        "Work Unit manager의 human-review-result 상태 계약 변경",
        "Project Core 목적, 원칙, 범위 또는 Human 결정 경계 변경",
        "plugin cachebuster 변경 또는 재설치",
        "역사적 Work Unit 재작성",
        "commit, merge, push, PR promotion"
      ]
    }
  ],
  "subsections": []
}
