{
  "id": "plan",
  "title": "Plan",
  "content": [
    {
      "id": "PLAN-001",
      "kind": "plan-step",
      "content": "Plan: 전체 Work Unit과 대상 구현을 읽고 descriptor ownership 및 기존 contract 보존 경계를 확정한다."
    },
    {
      "id": "PLAN-002",
      "kind": "plan-step",
      "content": "Work: 두 적대적 회귀 테스트를 먼저 추가해 실패를 확인한 뒤 최소 구현으로 통과시킨다."
    },
    {
      "id": "PLAN-003",
      "kind": "plan-step",
      "content": "AI Review: descriptor lifetime, no-follow traversal, index isolation, 오류 복구, CLI 호환성 및 scope diff를 검토한다."
    },
    {
      "id": "PLAN-004",
      "kind": "plan-step",
      "content": "Report: 집중·전체 검증 증거와 한국어 Human 체크리스트를 기록하고 승인·integration·cleanup 결정을 Human에게 남긴다."
    }
  ],
  "subsections": []
}
