{
  "id": "work-unit-basis",
  "title": "Work Unit Basis",
  "content": [
    {
      "id": "SPEC-001",
      "kind": "specification-impact",
      "content": {
        "status": "not-applicable",
        "reason": "기존 Agent Factory 역할·lifecycle 계약을 새 정책 없이 구현, metadata, 문서와 테스트 코드에 일치시키는 정합성 수정이다."
      },
      "attributes": {
        "status": "not-applicable"
      }
    },
    {
      "id": "BASIS-001",
      "kind": "work-unit-basis",
      "content": {
        "goal": "감사에서 확인된 에이전트 정합성 결함 7건을 기존 역할 계약에 맞게 수정한다.",
        "executionOrder": 1,
        "scope": [
          "Intake Agent resume CLI 수정",
          "Test Agent executionMode 및 failure handoff 수정",
          "6-role metadata 정합화",
          "문서·오류 문구·회귀 테스트 코드 정합화"
        ],
        "outOfScope": [
          "모든 테스트 및 검증 명령 실행",
          "__pycache__ 변경",
          "새 lifecycle 정책",
          "push, PR, deploy"
        ],
        "dependencies": []
      }
    },
    {
      "id": "BASIS-RECOVERY-001",
      "kind": "work-unit-basis",
      "content": {
        "goal": "기존 에이전트 정합성 수정 커밋을 이어받아 Review 차단 결함과 launcher recovery 고착을 해결한다.",
        "executionOrder": 2,
        "scope": [
          "기존 두 커밋 재사용",
          "Test 및 Documentation failure evidence 보존",
          "Review exact input contract",
          "launcher terminal failure recovery state",
          "no-test/no-verification prompt enforcement"
        ],
        "outOfScope": [
          "테스트 및 검증 명령 실행",
          "기존 stuck Work Unit canonical JSON 우회 수정",
          "자동 리뷰 반복 feature 통합",
          "push, PR, deploy"
        ],
        "dependencies": [
          "fix-agent-consistency-20260810 branch commits 0f471db and 8eba6bf"
        ]
      }
    }
  ],
  "subsections": []
}
